{
  "$schema": "http://json-schema.org/draft-07/schema#",
  "title": "Гісторыя — запіс пер-локальнага stops.json (Story)",
  "description": "Палі з 09 §3 (Story) у форме файла stops.json: story_id, place_id, tier, duration_s, voice_id, tone, sources[], review, плюс тэкст і транскрыпт. tier — асобныя радкі, не варыянты аднаго; «што бясплатна» — трывіяльны запрос. Інварыянт 1 з 09 §3: аўдыё ніколі без транскрыпту — таму transcript абавязковы. tone: memorial сцішае тэмп начытвання і забараняе trivia побач. review.decision = approved для ўсяго, што публікуецца (інварыянт 5). origin — рэзерваванае поле паходжання (G02.01, крытэрыі 2 і 4).",
  "type": "object",
  "required": ["story_id", "place_id", "tier", "duration_s", "voice_id", "tone", "text", "transcript", "sources", "review"],
  "additionalProperties": false,
  "properties": {
    "origin": { "enum": ["official", "imported"] },
    "story_id": { "$ref": "../schemas/identifier.schema.json" },
    "place_id": { "$ref": "../schemas/identifier.schema.json" },
    "tier": { "enum": ["base", "extended"] },
    "duration_s": { "type": "integer", "minimum": 1, "maximum": 86400 },
    "voice_id": { "$ref": "../schemas/identifier.schema.json" },
    "tone": { "enum": ["standard", "memorial"] },
    "text": { "type": "string", "minLength": 1 },
    "transcript": { "type": "string", "minLength": 1 },
    "sources": {
      "type": "array",
      "minItems": 1,
      "items": { "type": "string", "minLength": 1, "maxLength": 400 }
    },
    "review": {
      "type": "object",
      "required": ["by", "at", "decision"],
      "additionalProperties": false,
      "properties": {
        "by": { "type": "string", "minLength": 1, "maxLength": 140 },
        "at": { "type": "string", "pattern": "^[0-9]{4}-[0-9]{2}-[0-9]{2}$" },
        "decision": { "enum": ["approved", "rejected", "pending"] }
      }
    }
  }
}
