[
  {
    "story_id": "story-paid-1",
    "place_id": "e2e-place-4",
    "tier": "base",
    "duration_s": 6,
    "voice_id": "voice-be-1",
    "tone": "standard",
    "text": "Сінтэтычны тэкст свабоднай гісторыі платнага гіда для аўтатэстаў куплі; рэальнага кантэнту няма.",
    "transcript": "Сінтэтычны транскрыпт свабоднай гісторыі. Свабодны пласт публікуецца цалкам, таму гэты радок бачны без куплі.",
    "sources": [
      "Сінтэтычная крыніца: E2E-фікстура KUDY"
    ],
    "review": {
      "by": "аўтар e2e-фікстуры",
      "at": "2026-10-07",
      "decision": "approved"
    }
  }
]
