[
  {
    "story_id": "story-2-ext",
    "place_id": "place-1",
    "tier": "extended",
    "duration_s": 90,
    "voice_id": "voice-be-1",
    "tone": "standard",
    "text": "Платная гісторыя пра вяртуна млына: восьмы токен, дзявяты токен, дзясяты токен, адзінаццаты токен канавай фразы.",
    "transcript": "Платны транскрыпт пра вяртуна млына.",
    "sources": ["Дэма-крыніца: сінтэтычны архіў"],
    "review": { "by": "аўтар дэма", "at": "2026-09-26", "decision": "approved" }
  }
]
