[
  {
    "story_id": "story-2-ext",
    "place_id": "place-2",
    "tier": "extended",
    "duration_s": 6,
    "voice_id": "voice-be-1",
    "tone": "standard",
    "text": "Платны дэма-тэкст пашыранай гісторыі пра млынавага вяртуна: восьмы токен, дзявяты токен, дзясяты токен, адзінаццаты токен канавай фразы.",
    "transcript": "Платны дэма-транскрыпт пашыранай гісторыі: доўгі радок, які не павінен трапіць у публічны пласт ні пад якім выглядам.",
    "sources": ["Дэма-крыніца: сінтэтычны архіў"],
    "review": { "by": "аўтар дэма", "at": "2026-09-16", "decision": "approved" }
  }
]
