[
  {
    "story_id": "story-1-base",
    "place_id": "place-1",
    "tier": "base",
    "duration_s": 6,
    "voice_id": "voice-be-1",
    "tone": "standard",
    "text": "Дэма-тэкст базавай гісторыі пра сукнаны гандаль: сінтэтычныя сказы для праверкі зборкі і публічнага пласта.",
    "transcript": "Дэма-транскрыпт базавай гісторыі. Свабодны пласт публікуецца цалкам, таму гэты радок бачны без куплі.",
    "sources": ["Дэма-крыніца: сінтэтычны архіў"],
    "review": { "by": "аўтар дэма", "at": "2026-09-16", "decision": "approved" }
  }
]
