[
  {
    "story_id": "story-1-base",
    "place_id": "place-1",
    "tier": "base",
    "duration_s": 95,
    "voice_id": "voice-uk-1",
    "tone": "standard",
    "text": "Демо-текст базової історії про сукняну торгівлю: синтетичні речення для перевірки збирання.",
    "transcript": "Демо-транскрипт базової історії. Вільний шар публікується повністю, тому цей рядок видно без купівлі.",
    "sources": ["Демо-джерело: синтетичний архів"],
    "review": { "by": "демо-автор", "at": "2026-09-16", "decision": "approved" }
  }
]
