[
  {
    "story_id": "story-1-base",
    "place_id": "place-1",
    "tier": "base",
    "duration_s": 90,
    "voice_id": "voice-be-1",
    "tone": "standard",
    "text": "Шаблонны тэкст базавай гісторыі пра падворак качагараў: заменіце гэтыя сказы сваім апавяданнем пра месца. Форма файла прыкладзена такой, каб валідатар прайшоў з першага разу.",
    "transcript": "Шаблонны транскрыпт базавай гісторыі. Транскрыпт абавязковы для кожнай гісторыі: аўдыё ніколі не публікуецца без яго (09, разд. 3, інварыянт 1).",
    "sources": ["Шаблонная крыніца — заменіце на сваю"],
    "review": { "by": "аўтар шаблону", "at": "2026-09-18", "decision": "approved" }
  }
]
