[
  {
    "story_id": "story-paid-2",
    "place_id": "e2e-place-5",
    "tier": "extended",
    "duration_s": 6,
    "voice_id": "voice-en-1",
    "tone": "standard",
    "text": "Synthetic full text of the locked bell story; it must never reach the public layer before purchase.",
    "transcript": "Synthetic transcript of the locked story. The extended layer opens only after the extension purchase.",
    "sources": [
      "Synthetic source: the KUDY E2E fixture"
    ],
    "review": {
      "by": "e2e fixture author",
      "at": "2026-10-07",
      "decision": "approved"
    }
  }
]
