[
  {
    "story_id": "story-paid-2",
    "place_id": "e2e-place-5",
    "tier": "extended",
    "duration_s": 6,
    "voice_id": "voice-be-1",
    "tone": "standard",
    "text": "Сінтэтычны поўны тэкст зачыненай гісторыі пра звон; ён не павінен трапіць у публічны пласт да куплі.",
    "transcript": "Сінтэтычны транскрыпт зачыненай гісторыі. Пашыраны пласт адкрываецца толькі пасля куплі пашырэння.",
    "sources": [
      "Сінтэтычная крыніца: E2E-фікстура KUDY"
    ],
    "review": {
      "by": "аўтар e2e-фікстуры",
      "at": "2026-10-07",
      "decision": "approved"
    }
  }
]
