[
  {
    "story_id": "story-free-1",
    "place_id": "e2e-place-1",
    "tier": "base",
    "duration_s": 6,
    "voice_id": "voice-be-1",
    "tone": "standard",
    "text": "Сінтэтычны тэкст першай свабоднай гісторыі для скразных аўтатэстаў; рэальнага кантэнту тут няма.",
    "transcript": "Сінтэтычны транскрыпт першай гісторыі. Свабодны пласт публікуецца цалкам, таму гэты радок бачны без куплі.",
    "sources": [
      "Сінтэтычная крыніца: E2E-фікстура KUDY"
    ],
    "review": {
      "by": "аўтар e2e-фікстуры",
      "at": "2026-10-07",
      "decision": "approved"
    }
  },
  {
    "story_id": "story-free-2",
    "place_id": "e2e-place-2",
    "tier": "base",
    "duration_s": 6,
    "voice_id": "voice-be-1",
    "tone": "standard",
    "text": "Сінтэтычны тэкст другой свабоднай гісторыі для аўтатэстаў паўзы і аднаўлення; рэальнага кантэнту няма.",
    "transcript": "Сінтэтычны транскрыпт другой гісторыі. Свабодны пласт публікуецца цалкам, таму гэты радок бачны без куплі.",
    "sources": [
      "Сінтэтычная крыніца: E2E-фікстура KUDY"
    ],
    "review": {
      "by": "аўтар e2e-фікстуры",
      "at": "2026-10-07",
      "decision": "approved"
    }
  },
  {
    "story_id": "story-free-3",
    "place_id": "e2e-place-3",
    "tier": "base",
    "duration_s": 6,
    "voice_id": "voice-be-1",
    "tone": "standard",
    "text": "Сінтэтычны тэкст трэцяй свабоднай гісторыі з маментам каля першай кропкі; рэальнага кантэнту няма.",
    "transcript": "Сінтэтычны транскрыпт трэцяй гісторыі. Свабодны пласт публікуецца цалкам, таму гэты радок бачны без куплі.",
    "sources": [
      "Сінтэтычная крыніца: E2E-фікстура KUDY"
    ],
    "review": {
      "by": "аўтар e2e-фікстуры",
      "at": "2026-10-07",
      "decision": "approved"
    }
  }
]
